{"build_input":{"compiler_sha256":"e996bb0ea465fae70d3e3c66b3b6e02d33d2f1eb76d5958720578b6cf359cc2e","coverage":false,"cpu":"x86-64","debug":false,"environment":[{"name":"LANG","value_sha256":"99fed2d548c2eb1022f4067f97fe838a2c3ea60ee0e0f53086788505c3ababad"},{"name":"LC_ALL","value_sha256":"99fed2d548c2eb1022f4067f97fe838a2c3ea60ee0e0f53086788505c3ababad"},{"name":"SEEN_DETERMINISTIC_SEED","value_sha256":"36ab771eba23f49d7ae43af88c601f3de8fccb201250906a4085444ae765f2db"},{"name":"SEEN_HASH_SEED","value_sha256":"36ab771eba23f49d7ae43af88c601f3de8fccb201250906a4085444ae765f2db"},{"name":"SOURCE_DATE_EPOCH","value_sha256":"5feceb66ffc86f38d952786c6d696c79c2dbc239dd4e91b46729d73a27fb57e9"},{"name":"TZ","value_sha256":"7e5f76c94a635c217e282f79db4fc7ee4bfd9b64044166714067602cc4be620c"}],"features":["stable"],"input_digest":"aff2439283ef3af6bbe886748d26961c93bafcfba2e448794927a7107fd56eef","lock_sha256":"2709eb37661477dd6da0b7f7a81bdc30ee97d571b9cbdd492261d5439387b305","lto":"thin","object_cache_abi":"seen-object-cache-abi-v1","package_client_sha256":"9587c3014d56e9513a14e991f96eeec3256f2744ca8fc1d1cfd8f153cd08fdef","path_map":"/seen/src","pic":false,"profile":"deterministic","runtime_sha256":"d92c6a81b2ff50096bcda80885427d1f59a25b5f483f7055523504925d16ab23","sanitizer":"none","simd":"none","source_date_epoch":0,"source_tree_sha256":"f8f7cedeaf3e59806073ee15983bbabc7d4df34593dc1c9894a2ac3a7f4e8e55","stdlib_sha256":"6c68381b6df5a940cfb0baba81a6bc842c8ab29d3e7fb668f358dbedcc0d7d80","target":"linux-x86_64","toolchain":"seen-0.18.1 llvm-22.1.0 lld-22.1.0","triple":"x86_64-unknown-linux-gnu"},"cancelled":false,"case":"release-thin-lto","results":[{"artifacts":[{"bytes":4096,"executable":true,"name":"program","role":"executable","sha256":"1310ca2c8932dbd118668bd97442558a3e1f546b5e15c69699dfbd6024f548d8"}],"build_input_digest":"aff2439283ef3af6bbe886748d26961c93bafcfba2e448794927a7107fd56eef","cache":{"artifact_set_sha256":"e33b6bfc956bca414bf9c472392b7611e087fd80f0f64179f629005ae0d244bf","input_digest":"aff2439283ef3af6bbe886748d26961c93bafcfba2e448794927a7107fd56eef","key":"15cf269473cbf0c1626f5188c17f050c3187fa4bce6e0070b4dec36a401b3c40","state":"miss"},"cache_identity":"b17808f1c9a37caec87017941b48a69cf1662391c17306c7a5606a0103d6e3a0","cache_mode":"cold","compiler_origin":"checkout","exit_code":0,"id":"root-a-cold","path_map":"/seen/src","published_atomically":true,"root_identity":"0a16c2d64ed82e34fef8780a5148b423071b39fbc06b63f270c03b2eab5bbdb8","stderr_sha256":"e3b0c44298fc1c149afbf4c8996fb92427ae41e4649b934ca495991b7852b855","stdout_sha256":"e3b0c44298fc1c149afbf4c8996fb92427ae41e4649b934ca495991b7852b855"},{"artifacts":[{"bytes":4096,"executable":true,"name":"program","role":"executable","sha256":"1310ca2c8932dbd118668bd97442558a3e1f546b5e15c69699dfbd6024f548d8"}],"build_input_digest":"aff2439283ef3af6bbe886748d26961c93bafcfba2e448794927a7107fd56eef","cache":{"artifact_set_sha256":"e33b6bfc956bca414bf9c472392b7611e087fd80f0f64179f629005ae0d244bf","input_digest":"aff2439283ef3af6bbe886748d26961c93bafcfba2e448794927a7107fd56eef","key":"15cf269473cbf0c1626f5188c17f050c3187fa4bce6e0070b4dec36a401b3c40","state":"hit"},"cache_identity":"b17808f1c9a37caec87017941b48a69cf1662391c17306c7a5606a0103d6e3a0","cache_mode":"warm","compiler_origin":"checkout","exit_code":0,"id":"root-a-warm","path_map":"/seen/src","published_atomically":true,"root_identity":"0a16c2d64ed82e34fef8780a5148b423071b39fbc06b63f270c03b2eab5bbdb8","stderr_sha256":"e3b0c44298fc1c149afbf4c8996fb92427ae41e4649b934ca495991b7852b855","stdout_sha256":"e3b0c44298fc1c149afbf4c8996fb92427ae41e4649b934ca495991b7852b855"},{"artifacts":[{"bytes":4096,"executable":true,"name":"program","role":"executable","sha256":"1310ca2c8932dbd118668bd97442558a3e1f546b5e15c69699dfbd6024f548d8"}],"build_input_digest":"aff2439283ef3af6bbe886748d26961c93bafcfba2e448794927a7107fd56eef","cache":{"artifact_set_sha256":"e33b6bfc956bca414bf9c472392b7611e087fd80f0f64179f629005ae0d244bf","input_digest":"aff2439283ef3af6bbe886748d26961c93bafcfba2e448794927a7107fd56eef","key":"15cf269473cbf0c1626f5188c17f050c3187fa4bce6e0070b4dec36a401b3c40","state":"disabled"},"cache_identity":"b17808f1c9a37caec87017941b48a69cf1662391c17306c7a5606a0103d6e3a0","cache_mode":"disabled","compiler_origin":"checkout","exit_code":0,"id":"root-a-disabled","path_map":"/seen/src","published_atomically":true,"root_identity":"0a16c2d64ed82e34fef8780a5148b423071b39fbc06b63f270c03b2eab5bbdb8","stderr_sha256":"e3b0c44298fc1c149afbf4c8996fb92427ae41e4649b934ca495991b7852b855","stdout_sha256":"e3b0c44298fc1c149afbf4c8996fb92427ae41e4649b934ca495991b7852b855"},{"artifacts":[{"bytes":4096,"executable":true,"name":"program","role":"executable","sha256":"1310ca2c8932dbd118668bd97442558a3e1f546b5e15c69699dfbd6024f548d8"}],"build_input_digest":"aff2439283ef3af6bbe886748d26961c93bafcfba2e448794927a7107fd56eef","cache":{"artifact_set_sha256":"e33b6bfc956bca414bf9c472392b7611e087fd80f0f64179f629005ae0d244bf","input_digest":"aff2439283ef3af6bbe886748d26961c93bafcfba2e448794927a7107fd56eef","key":"15cf269473cbf0c1626f5188c17f050c3187fa4bce6e0070b4dec36a401b3c40","state":"miss"},"cache_identity":"ba15e900d8a62f6be7f2e6b41e3da0e7120a5befd23994735402f2f0074fa067","cache_mode":"cold","compiler_origin":"installed","exit_code":0,"id":"root-b-cold","path_map":"/seen/src","published_atomically":true,"root_identity":"235049db67094fd25bd75398b730aa6f8379ea6a60f5c50c4fe69ea39fa74ef0","stderr_sha256":"e3b0c44298fc1c149afbf4c8996fb92427ae41e4649b934ca495991b7852b855","stdout_sha256":"e3b0c44298fc1c149afbf4c8996fb92427ae41e4649b934ca495991b7852b855"},{"artifacts":[{"bytes":4096,"executable":true,"name":"program","role":"executable","sha256":"1310ca2c8932dbd118668bd97442558a3e1f546b5e15c69699dfbd6024f548d8"}],"build_input_digest":"aff2439283ef3af6bbe886748d26961c93bafcfba2e448794927a7107fd56eef","cache":{"artifact_set_sha256":"e33b6bfc956bca414bf9c472392b7611e087fd80f0f64179f629005ae0d244bf","input_digest":"aff2439283ef3af6bbe886748d26961c93bafcfba2e448794927a7107fd56eef","key":"15cf269473cbf0c1626f5188c17f050c3187fa4bce6e0070b4dec36a401b3c40","state":"hit"},"cache_identity":"ba15e900d8a62f6be7f2e6b41e3da0e7120a5befd23994735402f2f0074fa067","cache_mode":"warm","compiler_origin":"installed","exit_code":0,"id":"root-b-warm","path_map":"/seen/src","published_atomically":true,"root_identity":"235049db67094fd25bd75398b730aa6f8379ea6a60f5c50c4fe69ea39fa74ef0","stderr_sha256":"e3b0c44298fc1c149afbf4c8996fb92427ae41e4649b934ca495991b7852b855","stdout_sha256":"e3b0c44298fc1c149afbf4c8996fb92427ae41e4649b934ca495991b7852b855"},{"artifacts":[{"bytes":4096,"executable":true,"name":"program","role":"executable","sha256":"1310ca2c8932dbd118668bd97442558a3e1f546b5e15c69699dfbd6024f548d8"}],"build_input_digest":"aff2439283ef3af6bbe886748d26961c93bafcfba2e448794927a7107fd56eef","cache":{"artifact_set_sha256":"e33b6bfc956bca414bf9c472392b7611e087fd80f0f64179f629005ae0d244bf","input_digest":"aff2439283ef3af6bbe886748d26961c93bafcfba2e448794927a7107fd56eef","key":"15cf269473cbf0c1626f5188c17f050c3187fa4bce6e0070b4dec36a401b3c40","state":"disabled"},"cache_identity":"ba15e900d8a62f6be7f2e6b41e3da0e7120a5befd23994735402f2f0074fa067","cache_mode":"disabled","compiler_origin":"installed","exit_code":0,"id":"root-b-disabled","path_map":"/seen/src","published_atomically":true,"root_identity":"235049db67094fd25bd75398b730aa6f8379ea6a60f5c50c4fe69ea39fa74ef0","stderr_sha256":"e3b0c44298fc1c149afbf4c8996fb92427ae41e4649b934ca495991b7852b855","stdout_sha256":"e3b0c44298fc1c149afbf4c8996fb92427ae41e4649b934ca495991b7852b855"}],"schema":"seen-program-artifacts-v1"}
